{
  "schemaVersion": "1.0.0",
  "kind": "w0-runtime-launch-challenge-v1",
  "id": "W0-RUNTIME-CHALLENGE-{{RUN_ID}}",
  "runId": "{{UNIQUE_W0_VALIDATOR_RUN_ID}}",
  "receiverNonce": "{{BOOTSTRAP_CRYPTOGRAPHIC_NONCE}}",
  "preparedAt": "{{PREPARED_AT}}",
  "expiresAt": "{{CHALLENGE_EXPIRES_AT}}",
  "resolvedLaunchChallengePath": "{{OPERATOR_EXTERNAL_PREDECLARED_LAUNCH_CHALLENGE_PATH}}",
  "resolvedAuthorizationEvidenceRoot": "{{OPERATOR_EXTERNAL_PREDECLARED_RUN_AUTHORIZATION_ROOT}}",
  "authorizationEvidenceRootIdentity": "{{AUTHORITY_OBSERVED_RUN_AUTHORIZATION_ROOT_IDENTITY}}",
  "operatorExpectedConfigSha256": "{{OUT_OF_BAND_OPERATOR_EXPECTED_CONFIG_SHA256}}",
  "configSha256": "{{OPERATOR_CONFIG_SHA256}}",
  "packageSha256": "{{W0_PACKAGE_SHA256}}",
  "resolvedProjectRoot": "{{ABSOLUTE_RECEIVER_RESOLVED_PROJECT_ROOT}}",
  "projectRootIdentity": "{{BOOTSTRAP_OBSERVED_PROJECT_ROOT_IDENTITY}}",
  "resolvedTempRoot": "{{ABSOLUTE_BOOTSTRAP_FRESH_TEMP_ROOT}}",
  "tempRootIdentity": "{{BOOTSTRAP_OBSERVED_TEMP_ROOT_IDENTITY}}",
  "installedSkillReadClosureTreeSha256": "{{INSTALLED_SKILL_TREE_SHA256}}",
  "pythonExecutableSha256": "{{PINNED_PYTHON_EXE_SHA256}}",
  "validatorEntrypointSha256": "{{INSTALLED_VALIDATE_D5_ACCEPTANCE_SHA256}}",
  "supportArtifactSetSha256": "{{PREPARED_SUPPORT_ARTIFACT_SET_SHA256}}",
  "projectInputTreeSha256": "{{BOOTSTRAP_COMPLETE_PROJECT_INPUT_TREE_SHA256}}",
  "tempCopySetSha256": "{{BOOTSTRAP_TEMP_COPY_SET_SHA256}}",
  "readInputSetSha256": "{{BOOTSTRAP_COMPLETE_SOURCE_AND_TEMP_READ_INPUT_SET_SHA256}}",
  "expectedArgvSha256": "{{BOOTSTRAP_EXPECTED_ARGV_SHA256}}",
  "expectedCwdSha256": "{{BOOTSTRAP_EXPECTED_CWD_SHA256}}",
  "expectedEnvSha256": "{{BOOTSTRAP_EXPECTED_ENV_SHA256}}",
  "bootstrapScriptSha256": "{{INSTALLED_W0_RECEIVER_BOOTSTRAP_SHA256}}",
  "bootstrapHostSha256": "{{PINNED_POWERSHELL_EXE_SHA256}}",
  "status": "prepared-awaiting-authority",
  "pythonStarted": false
}
